name_of_quiz,gender,class,numb_of_questions,numb_of_comments,lang,topic
What Name Would Your Child Have If You Were A Celebrity?,Male,Who Are You?,6,10,Portuguese,Celebrity
What Star Sign Are You Actually Most Compatible With?,Female,Who Are You?,11,42,English,Astrology
This Short Quiz Will Reveal Your Dream City,Female,Who Are You?,7,4,English,Home
"We Know Which Kardashian-Jenner You Are Based On 12 ""Yes Or No"" Questions",Female,Who Are You?,12,8,English,Celebrity
Can You Go 7 For 7 On This Word Quiz?,Male,Trivia,7,6,English,Trivia
Do You Know When These Fruits And Veggies Are Actually In Season?,Male,Trivia,10,5,English,Trivia
We Know Which Two Hogwarts Houses You're In Based On The Houses You Sort These Disney Heroines Into,Female,Disney,7,13,English,Entertainment
Eat A Lot Of Food From Auntie Anne's And We'll Reveal Which TV Dog Is Your BFF,Female,Who Are You?,5,11,English,Food
Plan Your Ideal Valentine's Date And We'll Reveal Which European City You Should Move To,Unknown,Who Are You?,6,6,English,Romance
Bake A Cake And We'll Give You A Celebrity To Eat It With,Unknown,Who Are You?,7,29,English,Celebrity
Choose Your Favorite Phone Cases And We'll Guess Which iPhone You Have,Female,Can We Guess?,5,27,English,Technology
Get Ready For School And We'll Reveal Which Kind Of School Lunch You Are,Female,Who Are You?,8,11,English,Home
Choose Amenities For Your Perfect Luxury Apartment And We'll A Deep Truth About You,Male,Can We Guess?,11,25,English,Home
What Type Of Guy Are You Attracted To?,Female,Love,10,27,English,Romance
The Trendy Foods You Pick Will Reveal Where You Need To Vacation Next,Female,Who Are You?,6,20,English,Food
We Know How You're Spending Valentine's Day Based On Which Club Penguins You Swipe Right,Female,Love,10,6,English,Romance
"Which ""Stars Wars"" Character Is Your Best Friend?",unknown,Who Are You?,7,12,English,Personality
Can We Actually Guess Your Birthday Based On The '00s Playlist You Make?,Female,Can We Guess?,10,93,English,Personality
Answer These Five Questions And We'll Reveal Where You're Spending Valentine's Day This Year,Female,Love,5,15,English,Romance
Design A Beach House And We'll Give You A Creative Job To Pursue,Female,Who Are You?,5,21,English,Home
"If You're Always Late To Things, Then You'll Get 40/40 On This",Male,Trivia,40,12,English,Personality
"This Game Of ""Would You Rather"" Will Be Hard As Heck If You Consider Yourself A Homebody",Unknown,Who Are You?,9,7,English,Personality
React To These Situations And We'll Tell You If You're A True Gross Girl,Female,Who Are You?,10,19,English,Personality
Choose Eight Random Things And We'll Give You A Movie To Watch On Netflix This February,Female,Would You Rather?,7,11,English,Entertainment
Spend Way Too Much Money At Free People And We'll Give You A Memoir To Read,Female,Who Are You?,7,11,English,Entertainment
"Design A House And We'll Tell You Which ""Charmed"" Witch You Are",Unknown,Who Are You?,6,26,English,Entertainment
"Buy Six Items From Only And We'll Reveal Which ""Hunger Games"" Character You Are",Female,Would You Rather?,6,20,English,Entertainment
"How Well Do You Remember The Characters On ""Gilmore Girls""?",Female,Trivia,10,6,English,Entertainment
Have You Experienced All 16 Of These Period Nightmares?,Female,Trivia,16,30,English,Personality
Everyone Has A Type Of Cat That Matches Their Personality Perfectly Ñ Here's Yours,Female,Who Are You?,7,69,English,Personality
Can You Pass This Surprisingly Tough Brand Name Test?,Female,Trivia,8,24,English,Trivia
"Prove How Well You Know ""The Simpsons"" By Identifying These Minor Characters",Female,Trivia,12,35,English,Entertainment
Pick Who's Hotter And We'll Guess What Makes You Horny,Female,Love,22,44,English,Romance
Plan A Successful Galentine's Day And We'll Guess Your Favorite Valentine's Day Candy,Female,Can We Guess?,5,12,English,Romance
Tell Us What You're Like In The Bathroom And We'll Tell You What You're Like In The Bedroom,Male,Can We Guess?,12,35,English,Romance
Which Pet Should You Adopt Based On The Night In You Plan?,Female,Who Are You?,5,25,English,Personality
Can You Guess If These Oreo Flavors Are Real Or Made Up?,Female,Trivia,10,17,English,Food
Which European City Should You Visit This Year Based On The Home You Decorate?,Female,Who Are You?,9,17,English,Home
The Disney Wedding You Plan Will Reveal Which Disney Love Song You Should Use For Your First Dance,Unknown,Disney,5,17,English,Entertainment
"This Game Of Food ""This Or That"" Will Reveal If You're Actually A Kid At Heart",Female,Food,10,11,English,Food
Choose Five Desserts And We'll Give You A Movie To Watch Tonight,Female,Food,5,23,English,Food
"Using A Picture Of The Last Scene, Can You Guess These 16 Movies?",Male,Trivia,16,50,English,Entertainment
"Are You More Alyssa Or James From ""The End Of The F***ing World?""",Female,Who Are You?,7,10,English,Personality
It's Time To Find Out Which Kind Of French Fry You Are,Female,Food,8,31,English,Personality
Can You Spend Less Than $50 At A Fancy Supermarket?,Male,Food,8,35,English,Food
Watch Some Daytime TV And We'll Reveal Your Best Quality,Unknown,Who Are You?,5,10,English,Entertainment
Design Your Dream Home In Seven Steps And Receive A Valentine's Day Gift,Female,Love,7,19,English,Home
Build An Outfit And We'll Reveal Which Iconic Decade Boyfriend You'll Have,Unknown,Love,6,45,English,Romance
Only A Kardashian-Jenner Expert Can Remember 8/10 Things That Happened During Kylie's Pregnancy,Female,Trivia,10,23,English,Celebrity
Which Triwizard Tournament Champion Are You Based On Your Zara Clothing Preferences?,Female,Who Are You?,9,11,English,Fashion
"If You Ace This Population By Country Quiz, Then You're A Geograhpy Wiz",Male,Trivia,10,7,English,Trivia
If You Know At Least 11/15 Of The Cities These Famous Paintings Are In Then You're A True Art Lover ,Female,Trivia,15,6,English,Trivia
These Six Questions Will Reveal Your New '80s Boyfriend,Unknown,Love,6,26,English,Romance
Would You Survive A Serial Killer Movie?,Unknown,Who Are You?,9,37,English,Personality
"Which ""Mean Girl"" Character Are You Most Like?",Unknown,Who Are You?,9,14,English,Entertainment
"Everyone Has A Steve Harvey Suit That Matches Their Personality, Which One Is Yours?",Male,Who Are You?,5,7,English,Celebrity
Which Swimsuit Matches Your Personality?,Female,Who Are You?,9,29,English,Fashion
Choose Some Makeup And We'll Guess Your Strongest Personality Traits,Female,Who Are You?,5,19,English,Makeup
Rate These Art History Booties And We'll Reveal Your Renaissance Era Sexual Persona,Female,Love,12,25,English,Romance
Which New Diet Coke Flavor Should You Try Based On These Random Questions?,Female,Food,7,16,English,Food
Answer These Questions Honestly And We'll Give You An Inspirational Quote,Male,Who Are You?,12,22,English,Food
What % High Maintenance Are You Based On Your Morning Routine?,Female,Can We Guess?,10,56,English,Personality
Tell Us Which '00s Movies You Like And We'll Guess Your High School Popularity Status,Female,Can We Guess?,7,50,English,Personality
Tell Us On A Scale Of Monica To Joey How Much Of A Slob You Are And We'll Recommend A Cleaning Product,Female,Who Are You?,7,6,English,Entertainment
"These ""Yes Or No"" Questions Will Determine If You've Been In Love",Male,Love,9,31,English,Romance
These 10 Questions Will Reveal How F*@$!NG Metal You Are,Female,Who Are You?,10,41,English,Personality
"What Manhattan Neighborhood Is Right For You, Based On Your Taste In Food",Female,Food,9,33,English,Food
This Test Will Reveal If You And Your BFF Should Remain Friends,Female,Can We Guess?,8,9,English,Personality
Answer These 12 Questions And We'll Reveal Which College You Should Attend,Female,Who Are You?,12,19,English,Personality
Eat A Whole Bunch Of Food And We'll Tell You Which Tattoo To Get,Unknown,Food,5,31,English,Food
Design A House In Eight Steps And We'll Guess Your Dream Job,Female,Who Are You?,8,35,English,Home
This Quiz Will Reveal Your Relationship Status A Year From Now,Female,Can We Guess?,6,24,English,Romance
Which NFL Team Should You Root For Next Season?,Male,CAn We Guess?,6,28,Spanish,Personality
Plan A Dinner Party In Six Steps And We'll Tell You Who Your Celebrity Guest Will Be,Unknown,Who Are You?,6,34,English,Celebrity
Answer These Random Questions And Get A Song That Fits Your Personality,Unknown,Who Are You?,8,8,English,Personality
CUTOFF,,,,,,